{
  "register": "académique, neutre, précis",
  "context": "manuel universitaire d'histoire médiévale / féodalité",
  "conventions": [
    "Siècles en chiffres romains suivis de 'e siècle' (ex: XIIe siècle)",
    "Guillemets français « » et espace fine insécable avant : ; ? !",
    "Préserver la numérotation, dates, citations telles quelles",
    "Privilégier des formulations nominales claires plutôt que des calques anglicisés"
  ],
  "preferences": [
    "Éviter le sujet impersonnel 'on' lorsque le sujet est connu",
    "Favoriser des collocations académiques comme 'à l'égard de', 'vis-à-vis de', 'relève de', 'renvoie à'",
    "Stabiliser la terminologie technique sur l'ensemble du document"
  ]
}
